product_name,review_date,reviewer_name,reviewer_gender,reviewer_total_reviews,helpful_badge,award_count,review_title,review_content
CK Be,09/28/2023,IlMillimetro,F,4,,1,The song of a bamboo forest,"I'm a haiku lover: so simple to read, very difficult to write, disarmingly innocent. Here there is few room for interpretation: it's all clear from the beginning. This perfume celebrates silence or, maybe, the song of a bamboo forest. The opening is pure, citrusy bergamot with just a touch of rhubarb to give a bitter touch. The evolution of Amai Arashyiama plays with your imagination: some green, very smooth and woody note contribute to create a bamboo accord, sweetened by sugar and bamboo milk. As the fragrance dries down, the vertical structure of this bamboo forest invites your soul to elevation: another accord, this time a sacred one...incense. Defilitely not a liturgical one but more of a resinous, traditional frankincense smoke.
So easy to wear, the fragrance is not overwhelming and the projecetion is quite intimate (which to me is a plus!)"
CK Everyone,12/14/2013,Gold,F,726,,1,Unpretentious,"Olivier Pescheux created many best-selling fragrances, for example ""1 Million for Man"" for Paco Rabanne, ""Iris Noir"" and ""Voile d'Ambre"" for Yves Rocher or ""Feérie"" for van Cleef&Arpels. But he also did many ""niche"" scents for Diptyque. ""Let's move"" is a fragrance Pescheux composed for Benetton in 2012 and it's probably not going to become a blockbuster. Why? I guess it's too light and fresh and the formula is too commonplace. Up front we have citrus&pepper, followed by lavender&cedar. Tonka&vanilla smooth down the edges with their customary softness. ""Let's move"" is a very open and unpretentious scent, but it will probably not manage to insinuate itself into classic male cologne status. Not modern enough, not sexy enough, too quiet. But quite likeable."
Eternity for Men,11/10/2025,Ahmed22Ali,M,1,,1,Good for winter nights,"I completely in love with the scent of this fragrance the rosemary and the bergamot in the opening are great Start in dry down it's going darker with the woody notes and leather joining. It is very similar to amouage interlude black iris . Maybe more fresh in the opening.
Scent 9/10
Performance 8/10
Giving me 2 hours of projection and 7 to 8 hours of staying on the clothes and maybe 3 hours on the skin"
Eternity Moment,10/04/2025,riaxx,F,9,,1,This is everything that was missing in the original in my opinion,"I always felt like such a weirdo, when the original Libre wasn't my fav, I didn't hate it, it just wasn't me. Even the intense one. I am not the biggest vanilla girl, but something about this is just so well balanced. It smells expensive and floral and not heavy. The bottle is stunning oh my days it is gorg and i like this perfume a lot girl."
Eternity Moment,09/08/2025,Shadza,F,7,,21,Libre has been tamed,"I was very curious about this new flanker in the beautiful bottle.

The typical Libre DNA is recognizable here as well, just significantly simplified.
The orange blossom has been toned down considerably, and the lavender is also much more restrained than in the predecessors.

During the first half hour, Libre Vanille Couture evokes the least from all the flankers in the series for me.
Familiar yet different, it feels a bit too arbitrary. Hm...

Once the opening settles, the new promised twist becomes apparent.
A vanilla that beautifully shifts between soft sweet and warm soft.

I don't catch any rum in my nose.
Too bad, I could have imagined a well-crafted boozy touch as an exciting variant for cold winter evenings and fancy occasions.
On the other hand, Libre Vanille Couture thus avoids drifting into the more gourmand territory and can maintain the more mature aura of its predecessors.

Overall, the fragrance becomes significantly more harmonious from this point on, gaining a snug quality that I can particularly envision for the colder months.

So, is it a new candidate for purchase?
I love the Libre line mainly for its rather ""edgy"" DNA, the interplay of cool and warm, bossy and feminine.

This somewhat gets lost in ""Libre Vanille Couture | Yves Saint Laurent,"" which is why the fragrance will probably not replace my favorite variant ""Libre Le Parfum | Yves Saint Laurent,"" which it actually comes closest to for me.

For anyone who already has one of its sisters in their closet, it’s probably not a revelation, but still nicely done and worth a test.
Even those who found the predecessors perhaps too harsh might find happiness with this toned-down version."
Eternity Moment,08/24/2025,Ungestresst,F,33,,14,Dreamy Drydown,"Do I really still need you? I thought to myself after I heard about the release. I see the bottle .. read the notes .. YES, my Libre collection is probably going to get bigger! Ordered online from Paris right away .. a few days later it was there and I got to smell it for the first time .. once again a pricey blind buy. It was worth it! The original Libre is still there although for me it’s more the Libre Le Parfum but with such a dreamy vanilla drydown .. heavenly! I am in love! By the way, I don't perceive anything in the rum."
Eternity Moment,09/05/2025,Arrosa,F,48,HELPFUL REVIEW,8,Name is Program,"Here you initially get the original Libre DNA - lavender, orange blossom, and jasmine combined with vanilla - so nothing new at first.

However, the scent is distinctly warmer and more vanillic from the very beginning (and of course throughout its entire development). It strongly reminds me of the Libre Le Parfum variant, but it is actually ""different"" in its vanilla. The listed candy vanilla shines through wonderfully here. An authentic, slightly earthy, and perhaps even minimally animalistic vanilla. So definitely not a mundane baking vanilla or something similar. I find the twist very exciting. However, I don't get the listed rum or any other boozy note.

The bottle is also a dream and a ""must-have"" for Libre collectors and lovers. The limited edition makes it particularly appealing.

Anyone who generally likes Libre and is not averse to vanilla should definitely give it a try. But please make sure to test it on the skin and give the scent a little time. The scent on the test strip was not remotely like it was on my skin even after several hours."
Eternity Moment,09/08/2025,Sabrina001,F,7,,5,A Gem!,"Wow.. the appearance is already a highlight, and the scent even more so! At first, I was a bit hesitant due to the price, but my eyes simply made the decision. It feels significantly more sensual than its predecessors. I imagine it being perfect for winter, with an elegant coat, red lips, and a tightly pulled-back ponytail on a date.. After over 60 fragrances, I still don't have a clear favorite in the number 1 spot… maybe this will be it? Absolute recommendation, and perfect for gifting."
Eternity Moment,11/10/2025,Majka86,F,56,,2,"The Most Beautiful, Why Limited ?!","Libre is unfortunately not my line. I’ve tried them all, and somehow the lavender note doesn’t resonate with me here. Only the Libre EAU DE PARFUM INTENSE was the warmest for me.

It's a shame that this one is limited. I would immediately add it to my collection after just one test! The vanilla is more dominant here than the lavender, which makes it interesting for me, and the rum here... It won me over right away!

But limited, and I really don’t like that! I don’t like a love that’s limited in time.

But maybe it will eventually be added to the permanent collection.
It would definitely be the most beautiful in the line.
I also like the vanilla note from ""Black Opium Le Parfum | Yves Saint Laurent,"" and this is exactly it here!
Divine"
Euphoria Blossom,02/26/2018,Serafina,F,479,HELPFUL REVIEW,6,The Moomins from Finland,"The Moomins - friendly, troll-like mythical creatures with a hippopotamus-like shape - were not entirely unknown to me from my childhood, but apparently I was a bit too old for such series when they became more prominent on German television in the late 70s. I only just learned that the first books were written and illustrated by the Finnish/Swedish author Tove Jansson as early as the 1940s. The virtual home of the Moomins in the far north seems to have also inspired the Moomin perfume series by Demeter (alongside “Finnish Snowfield,” there’s also “Icelandic Aurora” and “Norwegian Wood”).

“Finnish Snowfield” is, in my opinion, a delicate, light floral scent with hints of lemon-juice-spiced herbal tea. The association with a bright sun shining over a powdery snowfield seems quite fitting to me, but I also can’t help but think of the first spring flowers waiting for their moment to emerge beneath the snow. Therefore, for me, it’s a perfume for the waning winter.
Moderate longevity, but at least it’s a perfume that is suitable for wearing and not just for “bringing to mind” certain scent images."
Truth Men,10/01/2025,Bex,F,36,,1,Fresh for a Sunday,"I got a dabber bottle in the Winter and I wasn't impressed. It smelled generic and fruity with some fresh notes but I didn't love it. I didn't even like it, it was SO boring. The bottle was still pretty so I kept it on my desk at work for decoration. Now that Spring as come around, so have I. I went to work perfume-naked and reached for my Pretty Pink for the first time in months. Today it's 50-65F and sunny and for the first time this scent makes sense. Pretty Pink is a summer cocktail that brings freshness for the fruit lovers. The citrus, basil, and Bellini notes stand out the most, with the floral middle notes blending everything together. The ambery, musky base is familiar and safe. If you typically love fruity florals and want something that's a little bit fresher and greener, but still in your comfort zone, Pretty Pink will get you through the warm weather, and look cute on your vanity for the rest of the year."
Truth Men,05/22/2025,jettodesu,F,19,,2,"Nice, but totally unexpected","We already know not to judge a book by its cover, but never judge a fragrance by its bottle! Not only the bottle, but the name of this perfume as well evoke something hyper-feminine, sugary sweet, and maybe tropical or red fruits. Instead, this is citrusy, fresh, and shockingly... unisex? So any guy that is brave enough to have a fragrance that looks like this, I think it might be worth a try. But to be honest, it doesn't seem like that unique of a fragrance, so if the bottle bothers you, you can probably find something a little less... ostentatious that gives you the same effect.

Anna Sui, you really know how to put some simple ass fragrances in extremely fancy bottles. And damn it, I'm gonna keep buying them until I have all those bottles... I'll just refill them with more interesting (or at least more fitting) fragrances."
CK One Summer 2020,09/26/2024,Dionysos2022,M,946,HELPFUL REVIEW,4,On a Early Morning...,"... standing in a hot day in the middle of the garden among the blooming flowers and inhaling their scents along with the freshness of the damp grass and the woods of the surrounding trees. I hold my coffee cup, sipping it enjoyably while I glide my bare feet over the grass. This is how every morning should start.

When applying this fragrance, the nose first encounters the green of the cypress, mixed with the slightly sharp freshness of ginger. A spicy and floral accord quickly follows. The woods that join at the end make the perfume dry and woody, giving it a masculine touch.

Here we have a beautiful fresh woody aquatic scent that can be worn by any age group. On warm and hot days, I see this as a great all-rounder for daytime wear that can be worn anytime and anywhere. The scent is masculine and is not necessarily for the ladies, but can certainly be tried, as perfumes smell different on every skin.

Anyone who enjoys a fresh woody aquatic masculine fragrance will find this quite suitable, and at a very good price."
CK One Summer 2020,06/24/2024,Koray3000,M,1,HELPFUL REVIEW,6,So beautiful yet underrated! Summer on the skin.,"In search of a new summer fragrance that suits me, I tried many perfumes. I stumbled upon this bottle and honestly didn't think much of it at first. It fits perfectly within a small budget but can easily compete with designer scents. I sprayed it on my arm and let myself be surprised:

The opening starts off beautifully citrusy and fresh. The citrus note isn't listed, but you can definitely smell it. However, the zesty opening fades away, transitioning into an iced tea vibe. Not peach or lemon, but a very unique, homemade iced tea that you would love to order on a warm summer day. The scent becomes a bit sweeter and smoother like an iced tea. At this point, you can really notice the similarity to YSL La Nuit de L'Homme.
As the summer day turns into a summer evening, the fragrance also shifts in that direction. It leaves behind a creamy, sweet scent reminiscent of a lemon muffin.

At this point, I have to mention the longevity. Unfortunately, it isn't very good, which is why I tend to spray it on multiple times a day because it’s just so enjoyable. You want to have it around you all the time and experience the evolution of the scent again and again.
That's why I carry it in a small mini atomizer to-go and sometimes reapply. At this price, that's also manageable without putting a strain on the wallet.

All in all, great scent, very underrated, and perfect for summer like an iced tea full of ice cubes. Highly recommended, and during the sale, you can get the 30 ml bottle for very little money."
CK One Summer 2020,12/28/2023,RichyScents,M,5,,4,Absolute No-Brainer!,"In my eyes, a completely overlooked freshie. I love the scent and have been wearing it almost daily for some time now. It's just very nice and fresh, but still a bit different from the others. The scent has replaced 360 Red by Perry Ellis for me as a feel-good, no-think fragrance. Sillage and longevity are top-notch for this category. Additionally, I find the bottle an absolute eye-catcher. Anyone looking for a new fresh scent should definitely give this one a chance."
Sheer Beauty Essence,02/19/2025,exii,F,2,,1,Almost My Signature Scent,"I (27F) received Exceptional Parfums' Simply Belle as a free sample dabber and fell in love with it on first sniff. It has checked all the boxes for me - except one.

It is bright, fresh, and uplifting without being overly juicy or juvenile. For me, it is the perfect ratio of floral to citrus, without one overpowering the other, nor blending so much that it smells overripe or sharp. I appreciate its simple and straightforward scent, as complex and wood-based blends gives me a headache. Its drydown melds into a sort of youthful, musky skin scent on me, still keeping that same floral-citrus blend with no specific notes screaming out.

I ordered this perfume in the winter and have been wearing it even in colder months, but it would definitely fall under a spring and summer scent. I could wear this any time of the day, but would envision it more of a refreshing morning and afternoon scent.

The one disappointment and only box it does not check is its longevity. It disappears after the first hour on my skin, which is quite disappointing for an EDP. On clothes, it lasts around two to three hours. There is almost no sillage after the first half hour, so on the positive side, it is safe for the office. Its market price is reasonable, so I don't feel guilty generously spraying it around like an EDT. I am currently trying different methods in hopes of prolonging its scent on me.

All in all, this would 100% be my signature scent if the longevity was better."
Sheer Beauty Essence,04/01/2021,Scentwitch,F,292,HELPFUL REVIEW,2,Not worth it,"I was given a bottle of Simply Belle to try it out. It’s not impressive. The floral notes don’t stand out singularly. I can make out Lily of the valley and Waterlily only. The rest falls together into a soup. At the end there’s a bit of musk, but overall this perfume doesn’t change much over time.
The scent is unappealing to me. It could be my personal chemistry that doesn’t boost the perfume. I don’t know.

The sillage is about 18 inches tops, longevity blessedly short. I don’t know how much it is new, but I wouldn’t buy it for myself. Perhaps a teenage girl might enjoy it."
CK One Summer 2012,02/01/2021,HannahHoch,F,11,HELPFUL REVIEW,4,Dusty green,"I do not understand the mediocre rating of this perfume, I think it is a very interesting fragrance. On my skin it turns out a little soapy jasmine at first and then the fragrance becomes very powdery, as if it could be crumbled with your fingers. At the same time I find it green but not fresh: it is like the green of leaves that are already very dry, like they are aged or tanned by the sun. I am not one of aromas with a floral predominance, but I really like this one from Rania J."
CK One Summer 2012,02/24/2014,Kxnaiades,F,50,HELPFUL REVIEW,1,a 180 from A La Nuit and other creamy indolic jasmines,"The bergamot hits at the opening and remains quite persistent on me. The musk, sandalwood and jasmine play supporting roles in this on my skin. The heliotrope gives this scent a powdery vibe, somewhat akin to the powder in YSL's Paris. It also has a similar bright sparkling nature, like in old bottles of Yvresse/Champagne. The sillage and longevity are good, about a foot from the body and longevity over four hours so far and maintaining the sillage. I find the quality good with no synthetic notes apparent. However this is more of a green/citrus scent and not so much a jasmine oriented scent. It would be on the other end of the spectrum from creamy jasmines like Serge Lutens' A la nuit."
CK One Summer 2012,02/14/2016,Turandot,F,839,,20,If only it were just Jasmine....,"I love the scent of pure, clean, heavy jasmine on a summer night. The most beautiful jasmine I experienced was in Tunisia. I think Egyptian jasmine, as indicated in the pyramid, is experienced similarly. I was all the more excited to test Jasmine Kâma and all the more disappointed by the result.

Jasmine as the theme of a fragrance may tolerate a leading top note to avoid coming on too strong. But everything else that has been added around Jasmine Kâma disturbs and distorts the animalistic heaviness of jasmine and robs the fragrance of the vibrant mood it is otherwise capable of evoking. This feels irritating and makes the scent simply loud and oppressive.

Patchouli and woods unnecessarily roughen the otherwise oily-silky smoothness, heliotrope is a lovely scent on its own with its friendly and rather harmless sweetness, but it does not fit at all with jasmine, and vanilla seems to be indispensable and is used almost inflationarily in my opinion. The base is quite pretty on its own, but for me it feels like it was accidentally added.

The name of the perfume had led me to expect a classic soliflore. But such a note must be allowed to stand on its own. Similar to a solitaire as a piece of jewelry, it cannot tolerate any other decorative embellishments, and thus, in my opinion, the jasmine in this fragrance has been robbed of its beauty."
CK One Summer 2012,10/12/2014,Ergoproxy,M,1130,,0,The Full Blast,"I waited until the last moment to test Jasmin Kâma, as I suspected a true floral monster with such a perfume name.

I was right with my assumption!

Jasmin Kâma should be called Jasmine Anesthesia for me!

I can't speak of a top and heart note with this fragrance, as aside from a soapy, animalistic jasmine note, I can't perceive anything else for hours.
What surprises me, however, is that despite the numbing intensity, I never felt uneasy or had a headache at any time.

Only after an eternity does the floral anesthesia fade, leaving a truly pleasant daze in the form of a really beautiful base note.

The jasmine then submits to a soft, pleasantly sweet accord, which nearly makes the strains of the floral blast fade into oblivion. But only nearly!

Aside from the base accord, the sillage is expansive, and it will probably not surprise anyone that the longevity is also quite impressive. On me, Jasmin Kâma lasted noticeably until the next shower, and even after that, I could still perceive a faint trace of it.

Those who, like me, do not particularly enjoy overly floral fragrances should be a bit more cautious with the dosage when testing Jasmin Kâma. However, jasmine lovers will surely get their money's worth here."
Eternity Summer 2013,03/12/2019,AromaX,M,33,,0,A pink fluffy cloud of muskus decorated with red berries,"""Pavlova"" is a pink fluffy cloud of transparent muskus decorated with red berries. Not the smell of the ""Pavlova"" dessert itself, but a sensual representation of it. Strawberry juice, an echo of ""Strawberry in cream"" (a popular candy from the USSR times) and a layer of sweet and sour jam from red berries. The muskus cloud here is not something I smell. I rather feel its presence as a sense of transparent fullness within the smell. A scene for the berries to play their role. It also remember similar musks as a feeling of pink mist from some aquarel-like perfumes of roses and peonies. An lovely light and airy fragrance..."
CK One Summer 2015,06/26/2023,ChicoRoch1,M,163,,2,Top marks for Nina,"Nina Ricci has been around for quite some time and she's not exactly know for creating masculine fragrances but the ones that she HAS made have all been very very good and Memoire D'Homme is no different. This nuclear sized spice rack acts like something right out of the 80s with great longevity and high quality. Nina Ricci brings it home and I wear it sparingly as it's not a casual everyday fragrance. The winter is when it behaves the best as the spicy woody notes permeate through the cold just like a hot knife through butter.

At 1st the beginning is kind of raunchy as the Licorice note sticks to your skin like glue but as time passes the other notes start to make their presence known throughout. I will say this though if you're not a fan of licorice then you probably will not care very much for this however. As for myself the Licorice note is not only nice but very necessary because that's the one note that makes it's presence clear. 4 or 5 sprays is all you'll need to get you through the day and most of the night. The other big players are Ginger, Nutmeg, Grapefruit, Pomelo, Vetiver, Amber, Cedar, Opoponax, Myrrh, Ambergris and Musk. As you can see this fragrance uses major league masculine notes and anyone within a few feet of you will know there's a true MAN in your midst. I can't say enough about it except try it for yourself."
CK One Summer 2015,10/12/2014,Zakaria80,M,10,,1,A well behaved licorice.,"Not the rule, but when you see a house with a lot of perfumes and only the very few are masculine (at least marketed at) then you get the impression that some real effort focus and time went down to create these special ones. The one I owned for quite some time and really liked was Memoire d'Homme.

Upon spraying you get the feeling that this is your typical men's cologne but it is not! You get a citrusy initial bang taking up almost the entire frame, but some nutmeg, ginger and definitely licorice are photobombing in the background.

The licorice... I got really acquainted with this note thanks to my partner's black soft licorice caramels she was stuffing my mouth with in the winter. In this composition the licorice is done right with a balanced feel to it thanks to grapefruit in the beginning and then the nutmeg. The ginger has a sparkling role keeping the structure somehow fresh.

And then there is the amazing woody semi sweet drydown that keeps going for hours on skin, not to mention its persistence on clothes. For me this is where this scent really shines. Like staring down at a pine(?) forest from a higher point with the traces of a licorice caramel you were torturing in your mouth to melt for 10 minutes. Great stuff people.

I am keeping the ""oh my god!! why did you discontinue such a wonderful underatted superfantastic scent?!?!?"" for some other time or scent...

Screw it...

oh my god!! why did you discontinue such a wonderful underatted superfantastic scent?!?!?"
CK One Summer 2015,01/02/2013,Drseid,M,828,,2,Bad Citric Woods...,"Not a fan. Many compare this to one of my favorite scents, Terre d'Hermes, but I really don't see much of the comparison... On my skin, this is all about licorice, nutmeg and cedar after the initial grapefruit top note. The cedar being the main similarity between the two scents to me. The grapefruit top note here is nice, but it lasts for just a few seconds and is gone, leaving just the licorice behind; transitioning to the nutmeg and cedar notes. I regret my blind buy of this one and have gave away my bottle with no regrets. Memoire d'Homme gets a below average rating of 2 stars out of 5 and an ""avoid"" recommendation."
CK One Summer 2015,12/25/2010,Bullitt,M,85,,0,Too Bold a Mixture...,"here is my first comment :-)

I received this fragrance as a gift about 4 years ago...

Unfortunately, my taste was completely missed!

The base notes might not be bad, but it seems to me that everything has just been mixed together at will. What ultimately comes out is a sweet - fruity mixture...

For anyone who, like me, prefers woody / leathery / spicy fragrances, this is definitely not suitable!"
