product_name,review_date,reviewer_name,reviewer_gender,reviewer_total_reviews,helpful_badge,award_count,review_title,review_content
Calvin Klein Women,05/04/2024,Eriele,F,322,,4,Jupp's Bright Red Rubber Boat,"As always, I can't resist the fragrance shelves and with a glance, I skimmed over the new arrivals. I found the shower gels from the company to be decent so far, but I struggled with the scents. This was also the case with the new fragrance Karma.

As a teenager in the 70s, the orange color with the oriental pattern immediately caught my eye. Flower Power, flared pants, miniskirts, platform shoes, Abba, and George Baker Selection flashed through my mind in seconds. This fragrance had to be tested. I expected something with patchouli, the trendy scent of the time, but that was a swing and a miss.

The opening was extremely sharp and artificial, and I felt like I was back in those days. Memories of a Saturday in my neighborhood came flooding back. Uncle Jupp set up the bright red rubber boat and the orange steep-wall tent for the nudist vacation in St. Peter-Ording. His wife, Siggi, arrived with her hair all done up and a huge cloud of hairspray behind her, like concrete. Kids Daggi and Rolli had baked waffles but burned them. You could do that as a teenager. Then Grandma Änne showed up. Freshly permed curls tinted purple and smelling of hairspray and hair salon. Son-in-law Kurt rolled up with the bakery on wheels, and the smell of bread mixed in. Everyone examined Uncle Jupp's setup. Then his kids checked the air mattress and the swim rings. Now there was also the smell of plastic toys. Smoking was fashionable back then and not a half crime, and cigarette smoke wafted everywhere.

All this scent mixture is the fragrance Karma. The opening is artificial, then a full blast of flowers where frangipani, tiaré, and ylang-ylang fought over who would dominate the scent. Accordingly, there is a disharmony. Later, the remaining notes also fought, and again, there was no winner. To me, it was a stench. Sorry, but that's how I perceived the fragrance.

Longevity is quite long, and unfortunately, for sensitive people, it's a headache candidate. The bottle visually appealed to me, but unfortunately, the content did not. Luckily, I only tested it."
CK One Summer 2011,11/11/2023,Myrtillajus,F,530,,1,Oh love this combination,"Tsar in Etruscan means ten.
And this is precisely the tenth fragrance of this brand.
10 is obtained from the total of the first four numbers, considered the number of perfection and at the same time of cancellation, it was thought to contain all the fundamental elements of the universe.
This creation, which may seem like yet another repetition of the rose/Oud/saffron combination, appears to my nose (which does not always appreciate these notes) to be really pleasant and well balanced, very wearable without being too opulent: no element prevails, the bergamot gives it freshness and the tonka bean creates a very sensual frame.
And yes, it is one of the few that I like in the genre and I would really like to wear it.
Sexy in its essentiality, truly beautiful.
I see it as ideal for the cooler seasons, or perhaps on summer evenings.
Excellent performance, lasts all day.
“With the Wind” drawn by Hughes."
Eternity Summer 2012,05/22/2024,Sarinotsorry,F,28,,4,It does smell like newly opened Macbook box,"The other review mentioning that it smells like a newly opened Macbook... is almost spot on. It does smell like when you open a new Macbook/iPad package. That airy, slightly cold metal smell.
However! I think the cloves note here is more prominent. So I guess it smells like if you're unboxing a new Macbook with a bowl of dried cloves next to you.

I actually find the scent to be so comforting and excellent. To be fair though, I do love the smell of cloves and new Macbook.

About its performance: on my skin & clothes, it has strong sillage. On my skin it lasts about 8+ hours before it becomes almost unnoticeable. On my clothes though... that's another story. I once gave 2 sprays on the blanket I use on my sofa, and my whole living room then smelled like this perfume for a whole week. It is beastly!"
Eternity Summer 2012,04/06/2025,Reddawks,M,82,,1,"Not my styl.e. And yet, I wear it.","I don’t usually like synthetic perfumes — the Molecule-type ones. Mostly because I don’t find them evocative, narrative, or descriptive. Plus, depending on the molecule, I sometimes can’t even smell them at all. So, 27 87 as a house — with Daniela Andrier behind several of their creations — has everything to put me off. They fully embrace their synthetic identity. Hashtag is no different. Some say it smells like opening a brand-new MacBook. They’re not wrong. There’s something plasticky, fresh — and then a curious incense note, light enough to be worn even in the heat. Musk, maybe.

It all evokes walking into a tech store run by someone cool, who added a faintly zen, chill touch to the decor. A very original perfume — and yet, super wearable and laid-back.

Not my style. And yet, I wear it.

Insta: switzer_scent"
Eternity Summer 2012,06/05/2018,Ergoproxy,M,1130,,4,It took three attempts,"Either it was my husband's persistence, my mood when I first tested the fragrance, or whatever else it was that made me not like the scent at first, but now I really like it and it is now in my collection.

#Hashtag (what a silly name) is a clean, very bright, and slightly metallic-sounding fragrance without much of a scent development.

The defining notes are, besides a soapy-synthetic aldehyde, a glaringly bright incense. Iris subtly powders the scent a bit, without the note really coming to the forefront. The (cedar) wood is somehow present, without being distinctly noticeable. It rather adds a certain dryness to the fragrance.

That the scent supposedly smells like a freshly unpacked notebook cannot be claimed. To me, it smells more like a mix of laundry day and church space.

In my now-deleted statement, I wrote that the idea is not exactly new, and I still stand by that impression. But in the end, that is irrelevant when I like the concept (even if only after the third test) and feel comfortable with the fragrance.
And after all, opinions are sometimes meant to be changed, aren't they?"
Eternity Summer 2012,03/31/2021,Tonishaja,M,7,,5,#Church scent would probably be more fitting,"In the description of the perfume, I imagined something soapy, fresh with a light incense note like Aqua di Gio Profumo.

Unfortunately, I was very disappointed, especially since it was a blind buy.

The first time I caught a whiff, I immediately thought of the comment that it is supposed to smell like a newly unpacked MacBook.

At first, I could really only smell something like something newly packaged.

After testing it a few times, I eventually smelled a bit more.
It smelled to me like being in a church with a slight freshness.

I only received one positive compliment that it smells like fresh laundry. Otherwise, most people thought I smelled like a church /:

Even though the scent is not my favorite, it has found a place for me.
I wear it on Sundays when I go to church :D"
Eternity Summer 2012,02/19/2025,Petermaffya,M,35,,5,Frankincense for Hot Weather - Thank God ...,"... my wife now also has to tolerate frankincense on me in the summer!

With ""#Hashtag | 27 87 Perfumes,"" we have a molecular fragrance that imitates the theme of ""freshness"" or possibly ""fresh laundry"" or ""fresh linen,"" all enhanced with a note of frankincense. The frankincense is well noticeable, yet subordinate like a breeze of freshness. I find the composition really successful and finely balanced.

What I particularly appreciate about the scent is truly the idea...
Fragrance lovers and fans of more interesting notes and compositions will particularly enjoy this, in my opinion. Because with Hashtag, you don't get a classic, ordinary freshie, but a fresh linen DNA that provides an interesting twist through the frankincense, thus opening the door for frankincense into the hotter days!

Great idea, great scent, looks cool too...

I’m glad I have it!"
Eternity Summer 2012,08/22/2025,lainnn,N/A,5,,3,Androgynous Android,"Extremely beautiful, clean, and subtle unisex scent. I love the comparison to opening the package of a new MacBook as the scent really strongly resembles that smell. I can understand why some people do not like this pure, cold synthetic fragrance, but it speaks to me extremely. To me, #hashtag smells like cold air, new technology, and familiar nostalgia. A cool consequence of..."
Defy Parfum,07/15/2022,Raigy666,M,3,,1,"Really nice, warm praline patchouli.","I took a great distance from this lens. I think it is a unisex fragrance that curls up to a female audience. The smell changes like a chameleon. but the dominant note is a delicate patchouli sweetened with pralines. I have a batch from 2017. the fragrance is not very designer, but it stays on for a long time. You can smell it on the clothes the next day."
Encounter Fresh,10/27/2018,IamCraving,M,7,,7,A Parisian in America,"The location of this charming rarity could not contrast more with its character. In the desert of Albuquerque, under the absurdly blue sky of New Mexico, stands a small white trailer among flea market stalls, street food vendors, and bargain tables.
Inside, there is not only a curious, versatile, and high-quality collection of fragrances - the storage space resembles Mary Poppins' handbag - but also two delightful young gentlemen who devote themselves ""only"" part-time to their passion for conscious, pleasurable, and curious smelling. I am warmly welcomed right away, subtly advised with knowing smiles, and the suggestions are all an eye-opener, almost all hits. Among a whole range of private Tom Ford fragrances, all of which can be filled in 10ml spray bottles, I am particularly taken by the French scent ""Delice Infini"" from La Bouquetière. I am warned. Not of getting lost in the infinity of indulgence, but of the glittery, shimmering layer that the delicacy brings. It is advised against applying it to textiles, but the velvety shimmer does not cause any discomfort to the skin; on the contrary, it guarantees a longer presence of the bouquet.

So here I am, traveling to the new world, lingering between the old hunting grounds of the Navajos and the new ones of American gun enthusiasts, crumpled by the nonexistent humidity, uplifted by the vastness of the sky and the desert, and then suddenly transported into a Parisian salon, equipped with pompous canapés and simple lily arrangements. The ceilings are high, as are the arched windows, the air is cool, as are the glances of the young French women who sip their Crémant, play Rummy, and scrutinize and dissect the company of Mademoiselle Z. They float upright in their cloud of infantile arrogance, which is reflected in their scent; their distance has something piercing about it, yet it stings so sweetly, a little sour, like the pearls in cold sparkling wine. The longer we linger in the dignified yet lurking atmosphere of the salon, the more sluggish our spirits become. We sink into the too-soft backrest of the canapé, the fragrant aura of the room grows warmer, enveloping us in a hint of youthful patchouli, white flowers, and noble sweat. Outside, it is 20 degrees warmer than in the venerable vault, where lime sorbet and biscuit are now being served. Observing, being observed, in vigilant excitement, aware of one’s own nobility. In another world, people are sweating; one can sense it, one is part of the season, carrying the sticky summer in the heart, the coolness in the head and chest.

Back in Albuquerque, I spend the rest of the day with Delice Infini on my collarbone by the Rio Grande. Even at 35 degrees, this unique storyteller scent works, accentuating and contrasting the heat equally."
CK In2U Heat for Her 2009,09/24/2013,MRoth,N/A,24,VERY HELPFUL REVIEW,9,The Golden Rule,"Take an old rotting wooden log. Set it to dry near a fireplace. Hollow it out, fill with dry dirt, whole vanilla beans, cinnamon bark and warm spices. Hide the log in the throne room of a sultan, let years of frankincense and sweet myrrh suffuse the wood. Heat the log over a fire and spoon some whipped cream on top.
Now step back and smell it as a complete scent: this is 24 Gold.

It wasn't love at first sniff, however. At first I worried that I'd received a dud batch or perhaps the oud note was not nearly what I expected. But I gave it time, first resigned to a bad blind buy, then cautiously optimistic, then enraptured! Gold is a good name for it, fitting in both hue and value; 24 Gold is one of few fragrances I have considered stocking up on just in case they decide to discontinue it, gold ingots stashed away from prying eyes.

It's not as much of a sillage monster on me as some others have described, I would actually prefer it to be stronger. It fares better sprayed on clothing but I enjoy it more when activated by body heat, so there's a trade-off. I do wish the bottle was a little transparent as due to the weight of it and the opaque metallic coating it is difficult to judge the level of perfume inside.

On a more personal note, I enjoy washing my hair with my coconut and Marrakesh oil conditioner and then liberally applying 24 Gold. Generally I avoid mixing perfumed products but they mesh together well. It encourages confidence and sensuality... I feel warm and mysterious, a desert priestess making libation."
CK In2U Heat for Her 2009,12/31/2012,Azrayel,M,10,HELPFUL REVIEW,8,Harvest for the Gold,"Ok guys, here is my own story, just today 17:10PM with 24 Gold.

15:45 PM - I logged out from work and will head to post office to check on my perfume orders. My male co-worker that is logging out by 16:00pm ask me if I want a lift going home. I said sure then we can meet some place outside office after I checked my p.o. box. Deal! He said.

15:50 PM - I arrived at Post Office, heading to my box then went to the counter to claim. Postman gave me the box, I read the sender, expecting to get the Agent Provocateur or Le Dandy edt &/or edp.
But the seller was from Amazon which means, this is 24 Gold.

I opened the package, and saw the gold and black classy 24 Gold and checked the authenticity, serial no. etc. It all match, an assurance of authentic purchase. Now my last test would be, to spray it. Gold cap was great, easy and tight at the same time. I tried to spray once, no perfume came out, another, still nothing. Then I am solved that this is the real deal.

15:57 - 1 spray to back hand. Oh sweet first smell, reminded me of Paco Rabanne Ultra Red and 1 Million. Very vanilla, creamy top, a little powdery but very pleasant, could be guaiac wood but definitely no oud, yet. Powerful projection.

Three minutes after oud is slowly manifesting, subtle and very pleasing equally combining with jasmine which astonished my nose, making me convinced that this is wonderful indeed. After 10 minutes, its sweetness lessen and oud/floral combo much detected now. Such a beautiful scent that is sensual, well blended, transforming and very oriental but not cloying.

16:10 - The projection outside the post office is outstanding. The cold winds enhanced the fragrance. I was walking to meet my co-worker at the pharmacy, to ride with him and with just a spray on my back hand, the scent is a massive cloak in a winter afternoon.
Just amazing to experience it.

16:15 - I hopped in to his car and whoa, he smelled it already and told me what scent was that? It is strong but it smells very good. So I told him the brand and he wants to see the bottle and he smelled the sprayer and said, it is different from how it smells on me, different but very good aroma. He asked me where I bought it coz it is the first time he heard about this perfume.

So that was it, my actual experience with 24 Gold that ended with an immediate compliment.

My two cents: I felt the presence of oud, floral, balmy, vanilla, woods, some spices and powdery effect. But my over all take is that this a beautiful perfume that will surely earn compliment especially to women. It is really powerful but never cloying. It has the qualities of a well refined, unique, sensual and classy perfume that has some slight resemblance here and there with other known perfumes (Ultrared, 1Million, Tobacco Vanille, Armani Code, Fantasy) but able to hold the oud that pops in and out. This is a hell of a thrill ride that is worth its price. I can say it will have a following even for those who are into niche perfumes. This is a blind buy for me but a successful one, With a luxurious fragrance & a high class bottle & box, my precious..."
CK In2U Heat for Her 2009,12/12/2014,MasterLi,M,376,VERY HELPFUL REVIEW,5,An instant hit!,"24 Gold by ScentStory is one of those fragrances that proves that in this industry, as far as the consumer is concerned... all that matters is the juice inside! In other words ""never judge a book by it's cover"", and that really sums it all for this one! People thought that ""how could a fragrance inspired by a TV show be any good?"". Wow! How everyone was pleasantly surprised! Again, this really shows how much we value ""brands"" and ""big names""... I mean if this was put in an exclusive flacon and released by a huge French fashion house (or by someone like Tom Ford) then we would be all over it! But instead it comes from a small company from the middle east and inspired by a TV show! Who would've thought it? Again it just shows you how quick all of us are to judge a book by it's cover!

So how does it smell? Well it is primarily an amber based fragrance (and a sweet one at that)! You have a combination between an amber softened by vanilla and musk (and also by the soft & creamy ""woody"" notes here like sandalwood, guaiac wood and oud - the last one in small quantities). I do actually detect the oud, but it's faint, and it doesn't overpower the fragrance in any way as the main notes of amber and vanilla dominate the scent.

Bottom line: This is a perfect scent for so many different occasions! I see it mainly as a cold weather scent, but if you spray very light it could be used for summer nights. It is (well) worth the money, which is very cheap for this level of quality in a fragrance... and it even puts some well established so-called ""designers"" to shame, by offering a borderline niche scent at half the price of a designer perfume! I would recommend this to people who like sweet amber or vanilla perfumes, with a woody background. It can be used casually, but I think this works best when you are out to ""impress"" in a formal setting (like a restaurant or high class bar), or an expensive banquet or something. If you can't test, and you like what I have just described, then don't be afraid to buy it. It is a sweet, woody, almost musky smell. Very warm and sensual. Especially good for winter and colder seasons. If you can't try it, buy it!"
CK In2U Heat for Her 2009,08/24/2014,ZeZe,M,2,,4,The Gold Standard...,"Events occur in real time...

The opening is sickly sweet and I assume this is due to the jasmine note which I guess I'm now not a fan of. I get gaiac with aoud faintly lurking in the background but never taking center stage.
Some users have detected a raspberry note, but this wasn't the case for me.
It takes about 20 minutes for the cloying to phase out. Not a fan at all in the opening, but hang in there & you will be rewarded in the dry down just as the case with the original A*Men.

After 20 minutes the fragrance smooths. It's a sweet woody tone, the aoud must be giving off a faint pulse, as I don't find it earthy or dry at all.

The dry down.. Beautiful..

Sure enough, like clock work I struck gold at the 90 minute mark..

It develops into a soft creamy gourmand scent. A solid 3-4 hours I'm left with a creamy vanilla custard scent, some cinnamon with a woody undertone.

It's sweet, but not a synthetic sugary scent 'Rochas Man' has which tends to be linear.
24 Gold definitely isn't linear, it's more refined & presents a luxurious vibe that is inviting but not dominating like '1 Million' is.

The projection up until this point has been very good.
5+hours in, it's approaching the skin scent stage. A gorgeous edible cinnamon scent.

This phase lasted for half a day (12 hours) no joke. I Woke up the following day, and I could still smell the trace on my hand, smelt like luxurious bar of soap.

Ideal scent

Warm, creamy, comforting & inviting in a subtle way.

If you enjoy 'Rochas Man', this is hands down the better choice. It's classier & smells more expensive.

Although '1 Million' has its own place in the night life environment, this is more ideal for a relaxed environment or occasions. Restaurant/movies/home/bedroom..

A lovely UNISEX fragrance which has an affordable price tag, smooth & creamy dry down which could be mistaken for a niche scent.

Verdict 8/10"
CK In2U Heat for Her 2009,01/21/2015,LicoriceRain,M,57,,2,Too musky and too harsh!,"I can easily smell the raspberry and the chocolate (and I happen to be a fan of raspberry), but it isn’t as nice as it sounds. I cannot understand all the good reviews. 24 Gold is too musky, and too harsh! Almost makes my eyes want to water. But while I appreciate the fact that it certainly isn’t feminine, I am sure there are better raspberry fragrances out there. I would rather wear something from the Dollar Store than to ever wear 24 Gold again."
CK In2U Heat for Her 2009,05/14/2018,Yos,M,3,,1,Unique but not good,"I respect that this is very unique to me and most people you meet won't have smelled anything like this. It is the longest lasting fragrance I've ever had with monster projection and longevity. But it just doesn't smell good, it's got a weird smell to it that I can't put my finger on. Definitely not mass appealing everyone I asked said they dislike it (12 people). Some said it..."
CK In2U Heat for Her 2009,10/08/2025,jamessub69,M,81,,1,No bad bot not good like mid,"Fear and Loathing in Perfumes Scents are subjective, but it's intriguing how we can always find someone go full glue-sniffing unhinged, in their vitriolic exaggerations in describing a standard Oud scent: one unc in the reviews has literally compared this to a vag*na from the middle ages while writing a full episode of middle ages whattapad fanfic of said woman taking..."
