product_name,review_date,reviewer_name,reviewer_gender,reviewer_total_reviews,helpful_badge,award_count,review_title,review_content
CK In2U Heat for Her 2009,02/17/2016,Rejuco,M,8,,83,"The perfect gift for ex-partners, GEZ collectors, and everyone else you deeply hate","I should have known... This unbelievably cheap-looking bottle, both in terms of material, color, and print. This manufacturer's website. And then there's the fact that the scent boasts being licensed from the ""official 24 television series."" All of this screams ""James Bond drugstore scent, but poorly made"" and ""Stay away!!!"" A thousand red alarm lights hang from the ceiling, someone stands in front of me and shoves an oversized ""STOP"" sign in my face. ""Don't do it niiiiiiiiight....."" I hear someone echo behind me with an outstretched arm...

What do I do? I beam at the scent bottle at the end of the dark corridor, which stands like the artifact in Indiana Jones' ""Raiders of the Lost Ark"" on a lit pedestal. My eyes sparkle. It is supposed to smell like vanilla. And vanilla. Also vanilla! OMG, yes, I have to have it. After all, I love CH Men, and if the scent isn't sweet, who is? Excuse me, someone down there has already warned another CH Men lover about this scent? Oh well, tastes differ. I WILL love this scent because I love vanilla! And when you think about vanilla, you always have that beautiful natural Bourbon vanilla in mind or rather in your nose. A lovely, milky scoop of vanilla ice cream, bought from the best ice cream shop in the whole city, on a beautiful summer day. Ah, delightful! What am I still talking about, I have to take that bottle off the pedestal and spray it on myself. Excuse me? Oh yes, of course, the payment for the sample first. Here, 5 €, please, now let me finally sniff!!

...

...

OH MY SH
*!!!! What the hell is THAT??

Anyone who loves this scent (and can thus obviously take a sick leave for life) should please stop reading. Because now begins a review of the worst kind. Because this creation from hell deserves nothing else.

Actually, I’m not one for pessimism, I usually refrain from commenting on scents I don’t like. But THIS is not a scent (which is why I will henceforth refuse to call it a scent, out of respect for the feelings of the other 66,000 perfumes here - let’s call this scent RTL, as smell and broadcast program are equally bad). This stuff is vanilla pudding that was left out in the blazing sun in summer 2013 and has been sitting in the same spot ever since. By now, countless insects have crawled in and promptly perished. And while they rot in this spoiled pudding, someone from ScentStory comes along and bottles it up. Of course, opaque, so you can't see the goo inside. Quickly rummaged through the trash and found some golden plastic foil from last carnival. Wrapped it around, traced the ""24"" from a radio alarm clock from the €1 store, and off to the shelves. Oh dear, even perfumeries like Douglas have a reputation to lose and refuse to offer this thing. After a Douglas employee immediately fell into a coma while sniffing the sample and a police report was threatened, the man from ScentStory ran out of the store, pondering. How does he sell this garbage to men/women?

“HA!” *snaps fingers like Vicky* “There’s this YouTuber, Jonas, Jeremias, or whatever his name is. He said several times he would wear crap if women liked it! [Original statement, note from the editor.] I’ll give him this junk, tell him women would go crazy for it, take my grandma and my sister with me to fake a bit of “Ohhhh!” and “Ahhh!” (after they’ve smeared some neutralizing cream from pathology under their noses) and BOOM, he’ll promote it and I’ll get rich, ahahaha, RIIIIICHHH!!”

And indeed, RTL achieves an unbelievable 7.9 in the Parfumo rating. I can only explain it by assuming that the people who have rated this crap so far thought it was a school grading system from 1 to 6, and 6 wasn’t enough for them. It wouldn’t be enough for me either.

Why the hell are there no negative numbers available here?!

Projection and longevity, I can unfortunately confirm without a doubt. For me, a solid 10! I sprayed a mini-squirt on my right arm and immediately an EMT stormed into the office asking where the patient was. Despite washing multiple times, I can’t get RTL off my skin. I now fear that it will still be detectable at my wedding (and I don’t plan to get married in the next ten years). Haha, my wedding! As if I would ever find a woman with this stink bomb... Forever alone, thanks to 24 - that would at least be an honest slogan!

So, for heaven’s sake, please do not buy this scent! You can’t possibly hate yourself so much that you would want to put yourself through this and even pay money for it!

Speaking of hate, this RTL is perfect for misanthropes! Do you want to have your peace? Don’t want to be stupidly approached from the side, like being asked for directions? Put on a gas mask and wear RTL! The whole gym is full again, all machines occupied? Wear RTL and the training area belongs to you! You’re throwing a party and the guests just won’t leave? Wear RTL and go to sleep peacefully ten seconds later. This thing is a better ""bouncer music"" in a club than any slow waltz!

Maybe I’ve just approached this all wrong and considered RTL as a “scent,” while its purpose lies in a completely different field: self-defense! In times when everyone is getting pepper spray and the prices have skyrocketed, like helicopter pilots when they smell RTL on the ground, 24 Gold comes just in time! This thing is better than any CS gas you can buy. A spray of it on the attacker and he will scream and run away. The best part is, you don’t even have to hit him in the face. A spray on his clothes is enough. Or just on the advertising column 20 m away from him. No phone or wallet that he could steal will be worth it to him.

And for the sensitive souls who always avoid satire magazines like “Titanic,” please forgive me this dark sentence, but if several people wore RTL, Cologne wouldn’t have happened. An arm's length distance? Good joke, Ms. Reker! A tiny spray particle of RTL on skin or clothing and the Cathedral Square belongs to you alone!

Therefore, as a scent, it has failed miserably (down to the core of the Earth, shot out the other side, and disappeared somewhere in the vastness of space, where it will be found by aliens who will cause revenge for a new “Independence Day” on Earth), but as an expression of “I hate you all and want you to know it!” it is perfect.

PS: I offer this crap in the souk, but I wouldn’t advise anyone to buy it. Not even for the ex-partners mentioned in the title who cheated on you, then crashed your Porsche, and subsequently emptied your bank account. You can’t hate a person so much that you would gift them this scent."
CK In2U Heat for Her 2009,02/19/2016,DerHoelgi,M,6,,17,The Vanilla Slap,"Last night, 10:15 PM in the kitchen. I had just come home from the afternoon shift and my significant other greeted me with a raised eyebrow and a wrinkled nose, saying, ""You don't usually wear that, do you? I don't know it at all, what kind of glue is that? Phew, it just smells like vanilla... no, I take that back, it STINKS only of vanilla!!! You have so many great scents..."
CK In2U Heat for Her 2009,01/30/2015,Unruh,M,97,,14,Hyped Instant Vanilla Pudding,"I wouldn't have thought it possible to encounter this fragrance in the wild, given the apparent production shortages.
Unfortunately, the bottle tends towards a similar tackiness as ""1 Million."" The fact that I’m not presented with a gold bar makes the impression of the bottle only slightly better. I hope the contents are better than the exterior suggests...

The opening of ""24 Gold"" offers, among other things, warm, spicy, resinous sweetness. I smell oud, not necessarily the highest quality, a diffuse, Christmas-like spice note, as well as hints of guaiac wood and floral-fruity tones that I cannot identify, which, however, fade away within the first few minutes. Sounds quite nice at first.
Unfortunately, the main player looms over it all. Sticky-sweet vanilla from start to finish. At the beginning, this sweet interplay of synthetic vanilla, resinous, gnarly oud, and the subtle, balsamic-sweet guaiac wood is overwhelming; I can initially only sense the spices and woods of the heart note.
Fortunately, the vanilla gradually recedes and finds an interesting balance with the spices and woods. I distinctly smell anise and fine sandalwood, with clove, cardamom, and dry cedar lurking beneath. Perhaps also a pinch of cinnamon, but I'm not sure. Together, this creates a light black tea or more aptly chai note with woody accents. Unfortunately, the overly sweet synthetic vanilla is still too present for my nose to warm up to it.
Towards the end, the sweetness of the vanilla finally subsides, and ""24 Gold"" becomes for me an almost wearable, amber-warm, distinctly vanilla cuddle scent.

I almost feared such an outcome with the fragrance pyramid and classification, but at the same time, I’m glad to have tested this scent. I can very well imagine the fragrance on guys in their prime disco age (especially considering the enormous longevity and projection) and also on some women. However, I don’t want to smell like that.
Now I have a craving for homemade vanilla pudding. Off to the kitchen! :)"
CK In2U Heat for Her 2009,11/04/2013,Leimbacher,M,2870,VERY HELPFUL REVIEW,14,"Golden Secret Tip, Not Just for Oud Fans","I would have never bought this without the YouTube hype surrounding the 24 fragrances here... but it was absolutely worth it, and I can only join in the praise. So much fragrance for so little money, and then also from a series like celebrity scents - you don't expect that, and you are almost shocked and overwhelmed by the niche quality. A very noble, fine powdery oud scent and one of the biggest surprises of the year, definitely a recommendation to also test the remaining 24 fragrances. But that’s something you can hardly do anywhere, so interested parties will probably have to buy it blind. But with the prices, it's bearable, and Gold is a charming, party-appropriate oriental scent that doesn't overwhelm western noses.

It reminds me of Dior Homme Intense or even M7, quite precisely in the middle of the two. But still unique and very pleasing. Woody and powdery, luckily there are only jasmine nuances. Instead, there’s a lot of syrup, vanilla meets raspberry/strawberry. Dreamy, sweet, and bitter at the same time. The floral elements only form the bright frame for the bitter-dark painting. It even has the chocolate/cocoa elements of a DHI or some Montale. Jammy and perfect for rainy autumn days. For me, the sweetness even stays behind the oud and never overdoes it.

Bottle: chic, golden, handy in the 50ml variant. Still, it didn’t have to refer so blatantly to the (very good) series with 24. Among fragrance enthusiasts, that’s somewhat frowned upon. But the scent itself usually convinces even the biggest critics.
Sillage: strong, dark, mysterious, and a sweet vanilla-anise undertone make it suitable for going out. And almost exclusively so. It’s way too strong for the office, too powerful and sweet for leisure activities.
Longevity: 10-12 hours. Another strong point!

Anyone who tests it blind would think more of Amouage, Armani Privee, or Tom Ford - all the more surprising that it’s really a scent from the Fox series. A dream scent that walks the fine line between oud-dark and syrup-sweet. I hope it finds even more fans and is my budget tip for the coming winter!"
CK In2U Heat for Her 2009,03/05/2015,Karli,M,27,VERY HELPFUL REVIEW,14,"And when you wake up, I'm no longer Manuel Neuer","That's exactly how I imagined it when I had the sample of 24 Gold on my arm and later on my neck: The hope for a 100% gourmand vanilla scent! In the end, however, it was all just a dream.

""If you want, you can have everything!"" says the nice lady next to me on the sofa. Damn it, how does she know what I want? I want cola when I order cola, not Cola Zero! Stuck label - Pah, what a cheater. She can wriggle around on the little bed as playfully as she likes!

I know gourmand scents - I have a whole shelf full of them! And indeed, 24 Gold belongs to this category. However, if you've experienced some of the higher-end fragrances during your perfume journey, then 24 Gold simply lags a bit behind. I find it synthetic and lacking depth and strength.

Or maybe it's the power of habit, because once you're hooked on cola, all other drinks taste strange. I don't know, decide for yourself!

Anyone who likes, admires, enjoys, and wears this scent should do so with pride. I wish you all the best with it. As for me, I don't celebrate with 24 Gold in the stadium, in the locker room, or with a nice girl in pajamas on the sofa. Why? Because it promised me more than it ultimately delivered.

Cheers!"
CK In2U Heat for Her 2009,08/05/2016,DieLora,F,12,VERY HELPFUL REVIEW,11,"Can, but doesn't have to","Negative headlines are known to be the best headlines. This is also the case here. Thanks to some partly grandiose and stylishly formulated comments, I became aware of this fragrance. Due to this perfect negative advertising, my expectations were high. What must this olfactory beast be, what an overwhelming experience? Can I even smell it or will it burn my nose hairs away in an instant? Is ""it"" even allowed on the skin or do I risk severe burns?

I had to get a sample! I couldn't miss this, I was too curious and sensationalist. Sprayed on in anticipation of a vanilla smack, waited... nothing. Huh, where is it? Sprayed again... a slight whiff of plastic vanilla, then nothing. Did I get the wrong sample or did my olfactory cells die at the moment of first contact? Well, lately it often happens that I can hardly perceive a new fragrance on the first test, however, my friend did not run out of the living room gasping for air, did not complain, nor did he turn green after three sprays of 24 Gold on my forearm. Either my skin immediately devours the scent, absorbing all the predicted terrible things from my writers in that instant, or our noses were numbed by the overdose. There was nothing more than a slightly artificial vanilla on a wooden base.

On the second test the following day, 24 Gold reached me, still miles away from being impactful. An unspectacular sweet wood-spice-vanilla, Oud not perceivable on me. Nothing special and similar to scents I've smelled countless times before, some better, some less so. A bit of Kalemat, a bit of Raghba. As someone here has already written, Bouquet Ideal also comes to my mind, which, however, becomes significantly sweeter on me and annoyed me after a short time.

In summary, 24 Gold is average. Not breathtakingly strong, but also not weak. Not particularly loud, not particularly quiet/unobtrusive. Not particularly sticky, but also not unsweet (yet still too cloyingly sweet for me). I didn't fall into a coma, my friend didn't leave me or throw me out of the apartment, my dog didn't leave the room howling, and my skin had no burns. That's just how it is with negative advertising - the expectations for the negatively advertised object are infinitely high, the craving for sensation awakens, and 24 Gold could not satisfy that.

Conclusion: You can wear it. But you don't have to."
CK In2U Heat for Her 2009,03/13/2015,DaveGahan101,M,535,,9,Solid,"Thanks to dear Achilles, I finally got to try this hyped fragrance. However, since I didn't find any hyped fragrance really great apart from Aventus, I was initially skeptical. That skepticism was basically unfounded, as the scent is quite well done. 24Gold is neither a disappointment, junk, nor a revelation. The problem is simply that you already know a large part of it. To..."
CK In2U Heat for Her 2009,10/08/2014,Achilles,F,83,VERY HELPFUL REVIEW,11,Oriental Allrounder,"Reformulation of my comment after a year on Parfumo:

24 Gold is for me the absolute crowning achievement of this ScentStory series, the outlier - because the others are, in my opinion, hopelessly unable to keep up. 24 Gold is still rightly
one of THE fragrances that easily surpasses many of my over 800 or more newly tested perfumes. It is still a revelation! 24 Gold is a damn revelation! The absolute fragrance twin of Kalemat, the only downside compared to Kalemat is that it lingers on clothing for days and on skin all day, all night until morning. The 24 says goodbye after a few hours, so you can nicely reapply. There we have the quality difference - but otherwise - Must-Have.

24 Gold is a blend of warm woods, vanilla pudding, oriental pastries, and spices, a souk in the midst of a sandy landscape, a wonderful Arabian oasis that I would love to drink - that is sandalwood and generally such great wood, so fantastically soaked with vanilla, oud, and amber. The fragrance offers an oriental creaminess that is unparalleled. It evokes wonderful fabrics at the bazaar, fragrant hair pomades, garments perfumed with various spices and incense, the scent of the Orient at over 30 degrees, mixed with the smell of sand.

The scent progression is linear for me, the skilled blend of oud, vanilla, and amber is ever-present. Not dirty, not musty, just sweet, creamy oud. This would be a fragrance that comes into the closer selection if one had to ruthlessly determine those that should accompany one longer, 24 Gold will accompany me for a long time. It is an allrounder, perfect for autumn and winter, but casual enough for summer, apart from the fact that I am not so tempted to differentiate there. It certainly does not overwhelm me when it's warm.
The fact that it is now supposed to be discontinued is not entirely clear to me, and anyone who has the opportunity to buy this should not hesitate long."
CK In2U Heat for Her 2009,09/22/2015,Sunstorm,M,34,VERY HELPFUL REVIEW,9,A must-have blind buy?,"Dear community

Here I am again, the slow (internal Swiss joke / note from the author) Bernese. But when it comes to buying perfume, I can be quite quick. 24...oh yes, I loved that series! It did get a bit stale after a few seasons with the same old formula, but that’s how it is with all long-running series. And the scent to go with it? Jack Bauer - full of energy, aggressive, selfless, intelligent. Action-packed! Something adventurous had to come out of this!! So what did the marketing folks and fragrance engineers come up with and launch???

I read reviews about it and watched some videos. Almost everyone is thrilled! And when I read through the pyramid, it looks like I should love the scent. Because: it’s sweet, a lot of vanilla...a lot of powder, a bit of wood. Yum, a winter scent for me? Could this replace my favorite cozy scent CH Men by Carolina Herrera? NO! Clearly!

I had to buy the scent online since it’s nowhere to be found (at least not in our small provincial capital). I assumed it would at least be mediocre, but...

The first spray on my wrist. A cloud hit me...really disgustingly artificial. What did it remind me of? Yes right, there used to be this artificially sweet vanilla pudding LIGHT. Omg, that was dreadful. And the scent now, what can I say to be polite? Artificially overly sweet Light-vanilla-something. But truly a yuck effect for my nose. You know what I mean, everyone has those scents that just smell disgusting to them. Unfortunately, 24 is one of those.

I still give it 40% because after a few hours it wasn’t quite as disgusting, but still definitely too sweet. Lol and I’m saying this, of all people, the one who could bathe in CH Men. Be that as it may. Unfortunately, this was a wrong purchase. At least it wasn’t expensive.

I really like vanilla ice cream, but this is just...artificial-powdery...nope, not at all. Especially not on a man over 25, but that’s just my opinion. It might be least noticeable if you’re baking cookies in winter and a lot of vanilla is floating around the room, then it might still work.

Wishing you a lovely autumn and see you at the next scent."
CK In2U Heat for Her 2009,05/27/2018,Sonny94,M,51,,0,K.O. in the 1st Round,"I don't want to spend too many words on this; others have already described the scent in detail.

To me, it only smells of overpowering synthetic vanilla, which makes you feel a bit nauseous. Oud can be detected a little in the background, but it doesn't stand out since the vanilla has already knocked it out in the first round.

The longevity was to be expected, very good; it would have been wise to tone it down a bit.

Not only does the design of the bottle share similarities with 1 Million, but also its abominable dirty sweetness."
CK In2U Heat for Her 2009,08/27/2018,Mantus,M,487,HELPFUL REVIEW,5,"Simple, Pleasant Embrace","At first, a fine rosy note can be perceived, which brings a very subtle smoky hint thanks to the guaiac wood. At the same time, a delicate, sweet, bright floral note is noticeable, which merges with the guaiac wood into a whole. I can very well imagine that the interplay with jasmine allows one to perceive a sweet raspberry, which completely disappears the closer I smell to..."
CK In2U Heat for Her 2009,11/09/2014,Hotscent89,M,18,HELPFUL REVIEW,9,Speechless !!,"First of all, I just have to say I'm completely blown away... What a magnificent fragrance !!

My first experience with a unisex fragrance was Meharees, which disappointed me quite a bit and also came off as far too feminine.

I was initially skeptical about 24 Gold and was pretty sure that it would disappoint me as well.

But I was so wrong that it couldn't have been any other way....

If I had to describe the scent briefly, I would say: A magical blend of ""Opium Pour Homme,"" ""Dior Homme Intense,"" and a hint of ""Jubilation XXV Man.""

Many might disagree with me here, but I suppose I shouldn't care.

It has that sweetness that comes from the berries in Opium Pour Homme, along with the delicious and soft vanilla. Then there's the seductive and elegant element of Dior Homme Intense, combined with the nobility and class of Jubilation XXV Man.

I can smell all of these more or less in this fragrance.
At first, the sweetness is really almost a bit too much, and the floral notes in the fragrance make it extremely soft. It would be a bit too feminine for me.

Then, after a while, when the vanilla takes over, the fragrance becomes a dream. Vanilla and amber enchant you, and there's a touch of cinnamon that gives the scent a subtle spiciness.

Jasmine and ylang-ylang skillfully play with the sweetness of the fragrance and meet relatively bright woods that lend a slightly masculine note to the scent.

This fragrance simply blows me away and could become my new favorite next to Dior Homme Intense.

The scent is the perfect blend of sweet, woody, and floral elements. Accompanied by a very dominant vanilla towards the end, a bit of cinnamon, and a slightly smoky amber with a hint of festive anise.

The fragrance fits perfectly with the Christmas season and thus into winter. On relatively cold autumn days, I can still imagine wearing it. But definitely nothing for spring or summer.

24 Gold is, after or maybe even alongside Dior Homme Intense, the most delicious oriental gourmand I have had the pleasure of getting to know.

The fragrance really lasts extremely long, and I can still smell it on myself after many hours. After 5-6 hours, it becomes closer to the skin, but even then, the sillage is still enough to let others partake in this masterpiece. Especially outside on cold days, your fellow humans will be delighted when a light breeze carries this scent to them. The fragrance creates an irresistible warm aura that one cannot escape. Warm, elegant, seductive, and even a bit sensual and erotic, it radiates all of that.

Longevity 9/10
Sillage 9/10
Scent 10/10
Price 100/10

As you can probably see from the points I have given here, the price scores extremely well.

I really can't explain how a fragrance of this class and level can have a price of under €30 for 100ml.
The fragrance is definitely unisex, and I would say it is equally wearable for both genders, but I would actually assign it a little more to men. Thus, it is easier for me to wear it with a good conscience !!

The fragrance was released in 2009 and is therefore a masterpiece of recent perfume history and will most likely one day attain the status of a classic.
For a long time, I searched for a winter fragrance worthy of residing alongside DHI and Midnight in Paris in my fragrance cabinet and settling there permanently.

Now I like it so much that it might even get the presidential suite.
In the end, I can only emphasize again: ""an incredible fragrance""

Everyone should test it and take the opportunity to acquire such a masterpiece for an extremely low price.

For the title of my comment being speechless, I have really found a lot of words, but I couldn't possibly withhold what I think of this fragrance from you.

Deserved 100%, and now the cold winter days can finally come, I am ready !!

So I have to go from 100% to 90%.

It doesn't quite reach my favorites DHI and MIP.

The fragrance is great, but already quite feminine, and the extreme sweetness can become overwhelming after a while. I definitely can't wear it regularly."
